{
  "schema_version": "ninereeds_sol_assembly_review_v1",
  "lesson_sha256": "df14ac94564a9161546ee8961e2238367cfb313ceb089efb70d6e4841f44e4bb",
  "reviewer_role": "sol",
  "decision": "pass",
  "checks": {
    "ordered_entry": true,
    "single_point": true,
    "prerequisites": true,
    "PPP_order": true,
    "answer_contracts": true,
    "world_chronology": true,
    "visual_claims": true,
    "visual_necessity": true,
    "stopping_rules": true
  },
  "findings": []
}
