{
  "schema_version": "ninereeds_sol_assembly_review_v1",
  "lesson_sha256": "e8391c6f4fb6468b5ab4d3061665a9a018363adec3509f09cf64102b3c66369a",
  "reviewer_role": "sol",
  "decision": "revise",
  "checks": {
    "ordered_entry": true,
    "single_point": true,
    "prerequisites": true,
    "PPP_order": true,
    "answer_contracts": true,
    "world_chronology": false,
    "visual_claims": false,
    "visual_necessity": true,
    "stopping_rules": true
  },
  "findings": [
    "Stage 11 visual acceptance / Stage 13 assembly repair: scene-taro-hands-phone-to-emma is essential to the frozen world objective and its exact pixels visibly show the intended single-phone Taro-to-Emma hand-off, but anonymous-pixel-review.json contains no asset_result for that asset. The candidate nevertheless labels it reviewed_usable and embeds an accepted verification attributed to that receipt. Obtain an independent claim-by-claim pixel result for asset SHA-256 6d72679c1cfec6e7a9b89ed45cf50c9857af1d0ab4fdca7f9743e41dfc5d12b4, then reassemble only from the resulting real receipt.",
    "Stage 12 comprehension repair: neither narrative check measures the selected world objective that stable identity persists through the depicted Taro-to-Emma transfer. nc-01 and nc-02 test only speaker attribution for isolated replayed turns, and da-01 is direct learner self-identification; the hand-off page, same-phone continuity, and ordered Taro-to-Emma transition can all be ignored. Add a closed, prerequisite-safe comprehension control grounded in the accepted hand-off pixels and cited story evidence, without adding new language or world facts.",
    "Stage 13 world-binding repair: picture_book.world_grounding.selected_world_objective substitutes stability of five names across presentation/drills for the frozen objective, while world.recurring_entities lists Ninereeds and Taro but omits Emma even though canonical Emma is a persistent participant in the hand-off and second half of the story. Restore the exact frozen Taro-to-Emma hand-off objective and reconcile Emma's L000 introduction/availability metadata before freeze; if that metadata is absent upstream, return to the deterministic world/selection binding rather than inventing it in assembly.",
    "Stage 13 accounting-metadata repair: selection.predicted_dosage says 'eight story pages', but execution_sequence and the story terminal rule correctly contain nine pages (page-01 through page-08 plus page-04-handoff) and 18 story turns. Make the frozen dosage description agree with the executable nine-page, 96-turn base path. The mixed controller itself is sound: all 20 frozen mixed IDs are mandatory before success is computed, and replay_lesson re-executes the same frozen 96-turn base path with reset mixed counters."
  ]
}
