{
  "schema_version": "ninereeds_sol_assembly_review_v1",
  "lesson_sha256": "6551fa1d746cf7215062ae79453c0f82e208053264c5b5d38924d90b9173ac73",
  "reviewer_role": "sol",
  "decision": "revise",
  "checks": {
    "ordered_entry": true,
    "single_point": true,
    "prerequisites": true,
    "PPP_order": true,
    "answer_contracts": true,
    "world_chronology": true,
    "visual_claims": false,
    "visual_necessity": true,
    "stopping_rules": true
  },
  "findings": [
    "Stage 13 exact script assembly must restore a frozen visual_plan.operations entry for scene-emma-errol. That asset is learner-visible as a demonstration and scored after-scene option in nc-01-handoff-phone-identity and is present in assets with an accepted independent pixel receipt, but it has no operation recording its generation prompt, attempts, receipt, and claim-by-claim verification. Losslessly assemble that accepted Stage 9 operation; do not improvise or alter the lesson.",
    "Stage 13 exact script assembly must replace the synthesized one-claim verification embedded in op-scene-taro-hands-phone-to-emma with the independent receipt's actual four claim_results covering Taro/Emma identity, the one-phone hand-off relation, Ninereeds screen identity, and relation-operand completeness. The current verification is not a lossless claim-by-claim copy of the supplied anonymous pixel review."
  ]
}
