{
  "schema_version": "ninereeds_sol_assembly_review_v1",
  "lesson_sha256": "b2cabc680ba7adb2c999b2767d4e62ab41d94bff4a2865c27b183902b96d7c7c",
  "reviewer_role": "sol",
  "decision": "revise",
  "checks": {
    "ordered_entry": true,
    "single_point": true,
    "prerequisites": true,
    "PPP_order": true,
    "answer_contracts": true,
    "world_chronology": true,
    "visual_claims": true,
    "visual_necessity": true,
    "stopping_rules": false
  },
  "findings": [
    "Stage 13 repair: use one unambiguous phase namespace for the five closing recap items. They are stored in phases.transfer and execution_sequence calls the phase transfer, while completion_thresholds also calls it transfer, but phase_terminal_rules, overall_mastery, and FINISH eligibility call the same path recap. As assembled, a controller keyed by the execution phase has no transfer terminal rule and cannot waterproofly establish the terminal outcome required by FINISH. Rename or explicitly map this phase consistently across execution, thresholds, terminal rules, mastery, and finish eligibility without changing the five frozen prompts."
  ]
}
