{
  "schema_version": "ninereeds_sol_assembly_review_v1",
  "lesson_sha256": "5b7cffb2f9f568bfc40e53b26f407c7cefc86aa0c8e5abd5a54cf47c4e5e4b04",
  "reviewer_role": "sol",
  "decision": "pass",
  "checks": {
    "ordered_entry": true,
    "single_point": true,
    "prerequisites": true,
    "PPP_order": true,
    "answer_contracts": true,
    "world_chronology": true,
    "visual_claims": true,
    "visual_necessity": true,
    "stopping_rules": true
  },
  "findings": [
    "Fresh whole-lesson review passes. The canonical execution sequence now assigns the worked story-interface item plus its unscored check and six story-sequence checks to comprehension, assigns the eight unseen-photo bare-label checks to a distinct transfer phase, and retains the eight bank-v2 retrievals in a separate closing_recap phase; the three inventories are disjoint and agree with the runtime states and finish predicate. All ten picture-book assets and operations now truthfully declare methodology-licensed reuse, while their paths, bytes, and SHA-256 values are unchanged from the previously reviewed draft and exactly match the accepted composition and pixel-review evidence. All source bindings and all 55 asset hashes resolve. Recomputed base accounting remains 32 presentation label turns, 4 interface checks, 32 controlled items, 32 mixed items, 24 story label turns, 2 story-interface units, 6 sequence checks, 8 unseen transfers, and 8 recap units, totaling 148; 148 base plus 92 bounded adaptive additions plus the preflighted 148-unit replay equals each 388-unit cap. The Point, Topic, prerequisites, vocabulary scope, target language, language boundary, story/world claims, answer contracts, adaptive replay guards, and chronology are unchanged, and no new contradiction was found. Static review passes and rehearsal may resume."
  ]
}
